titulo,cidade_estado,autoria,ano,link_experiencia
Informatização e Sistematização do monitoramento de sintomáticos respiratórios no município de Vitória-ES,Vitória - ES,THAIS CAMPOLINA COHEN AZOURY,2021,https://portal.conasems.org.br/brasil-aqui-tem-sus/experiencias/1341_informatizacao-e-sistematizacao-do-monitoramento-de-sintomaticos-respiratorios-no-municipio-de-vitoria-es
Atendimento integral e prevenção de adoecimento e de sofrimento psíquico durante a pandemia da COVID-19: iniciativa de Suporte à Saúde Mental por equipe multidisciplinar dE Unidade DE SAÚDE DE VITÓRIA,Vitória - ES,TATIANI ALMEIDA LOUZADO SANT\'ANNA,2021,https://portal.conasems.org.br/brasil-aqui-tem-sus/experiencias/1348_atendimento-integral-e-prevencao-de-adoecimento-e-de-sofrimento-psiquico-durante-a-pandemia-da-covid-19-iniciativa-de-suporte-a-saude-mental-por-equipe-multidisciplinar-de-unidade-de-saude-de-vitoria
"“A PANDEMIA DE COVID-19 E A ATUAÇÃO DOS ASSISTENTES SOCIAIS NA POLÍTICA DE SAÚDE: POTÊNCIAS, FRAGILIDADES E POSSIBILIDADES” ",Vitória - ES,CLARICE MACHADO IMPERIAL GIRELLI,2021,https://portal.conasems.org.br/brasil-aqui-tem-sus/experiencias/1347_a-pandemia-de-covid-19-e-a-atuacao-dos-assistentes-sociais-na-politica-de-saude-potencias-fragilidades-e-possibilidades
PROTOCOLO DE BIOSSEGURANÇA PARA VISITA DOMICILIAR NA ATENÇÃO BÁSICA EM TEMPOS DE PANDEMIA - UM PROCESSO DE EDUCAÇÃO NA SAÚDE.,Anápolis - GO,JULIA MARIA RODRIGUES DE OLIVEIRA,2021,https://portal.conasems.org.br/brasil-aqui-tem-sus/experiencias/1349_protocolo-de-biosseguranca-para-visita-domiciliar-na-atencao-basica-em-tempos-de-pandemia-um-processo-de-educacao-na-saude
Uso de Bot CoronaWhats para triagem da Covid-19 e orientação da população,Goianésia - GO,ANA RAQUEL PEREIRA SEVERINO FAQUINI,2021,https://portal.conasems.org.br/brasil-aqui-tem-sus/experiencias/1351_uso-de-bot-coronawhats-para-triagem-da-covid-19-e-orientacao-da-populacao
Inquérito soroepidemiológico para investigação da Covid-19 realizado na população do município de Goianésia – GO. ,Goianésia - GO,BRUNA LAUANNE BORGES DIAS GOMES,2021,https://portal.conasems.org.br/brasil-aqui-tem-sus/experiencias/1352_inquerito-soroepidemiologico-para-investigacao-da-covid-19-realizado-na-populacao-do-municipio-de-goianesia-go
"SAÚDE MENTAL, NUTRICIONAL E FÍSICA DOS TRABALHADORES DE SAÚDE DO MUNICÍPIO DE MUNDO NOVO/GO EM TEMPOS DE COVID-19",Mundo Novo - GO,DANIELA SILVA FARIA,2021,https://portal.conasems.org.br/brasil-aqui-tem-sus/experiencias/1350_saude-mental-nutricional-e-fisica-dos-trabalhadores-de-saude-do-municipio-de-mundo-novo-go-em-tempos-de-covid-19
Momento de acolhida: uma proposta de cuidado ao cuidador,Senador Canedo - GO,JOSé GOMES FERNANDES MORAIS,2021,https://portal.conasems.org.br/brasil-aqui-tem-sus/experiencias/1354_momento-de-acolhida-uma-proposta-de-cuidado-ao-cuidador
Musicoterapia e acolhimento psicológico na APS: estratégias de enfrentamento do estresse laboral durante a pandemia por COVID-19.,Senador Canedo - GO,PAULO HENRIQUE SILVA COSTA ,2021,https://portal.conasems.org.br/brasil-aqui-tem-sus/experiencias/1353_musicoterapia-e-acolhimento-psicologico-na-aps-estrategias-de-enfrentamento-do-estresse-laboral-durante-a-pandemia-por-covid-19
RELEVÂNCIA do cuidado da SAÚDE mental do PROFISSIONAL de SAÚDE diante de uma pandemia.,Carutapera - MA,TAYANE SIQUEIRA DE LIMA E SILVA,2021,https://portal.conasems.org.br/brasil-aqui-tem-sus/experiencias/1355_relevancia-do-cuidado-da-saude-mental-do-profissional-de-saude-diante-de-uma-pandemia
"O TrAbalho Da equipe MULTIProfissional de enfrentamento a covid, dentro das ações do programa saúde na escola.",Mata Roma - MA,GUSTAVO ADRIANO DE MATOS CORRÊA,2021,https://portal.conasems.org.br/brasil-aqui-tem-sus/experiencias/1356_o-trabalho-da-equipe-multiprofissional-de-enfrentamento-a-covid-dentro-das-acoes-do-programa-saude-na-escola
"IMPLANTAÇÃO DE UM CENTRO DE TRIAGEM PRA COVID-19 NO MUNICÍPIO DE PIO XII, ESTADO DO MARANHÃO.

",Pio XII - MA,ITALO ROGER FERREIRA TORRES ,2021,https://portal.conasems.org.br/brasil-aqui-tem-sus/experiencias/1359_implantacao-de-um-centro-de-triagem-pra-covid-19-no-municipio-de-pio-xii-estado-do-maranhao
REDE ACOLHE: ENFRENTAMENTO À COVID-19 NO ÂMBITO DA ATENÇÃO PRIMÁRIA EM SAÚDE,São José de Ribamar - MA,WILLIAN VIEIRA FERREIRA ,2021,https://portal.conasems.org.br/brasil-aqui-tem-sus/experiencias/1360_rede-acolhe-enfrentamento-a-covid-19-no-ambito-da-atencao-primaria-em-saude
FLUXO EMERGENCIAL DO HOSPITAL DA MULHER EM SÃO LUÍS-MA GARANTIA DE SEGURANÇA NOS PROCESSOS COM QUALIDADE EM RELAÇÃO AOS INTERNADOS DE COVID-19.,São Luís - MA,PRISCILA UCHOA DE CAMPOS ,2021,https://portal.conasems.org.br/brasil-aqui-tem-sus/experiencias/1358_fluxo-emergencial-do-hospital-da-mulher-em-sao-luis-ma-garantia-de-seguranca-nos-processos-com-qualidade-em-relacao-aos-internados-de-covid-19
AÇÕES DO CENTRO DE INFORMAÇÕES ESTRATÉGICAS DE VIGILÂNCIA EM SAÚDE-CIEVS DE SÃO LUÍS/MA NO ENFRENTAMENTO À COVID-19.,São Luís - MA,EVA ,2021,https://portal.conasems.org.br/brasil-aqui-tem-sus/experiencias/1357_acoes-do-centro-de-informacoes-estrategicas-de-vigilancia-em-saude-cievs-de-sao-luis-ma-no-enfrentamento-a-covid-19
ORIENTAÇÕES SOBRE OS PROTOCOLOS DE ATENDIMENTO PARA PREVENÇÃO DA COVID-19 PARA VENDEDORES DE ALIMENTOS DE PEQUENAS BANCAS E CARRINHOS DE MÃO NO CNTRO HISTÓRICO E ADJACÊNCIAS EM SÃO LUÍS/MA.,São Luís - MA,RAYNA OHANA CASTELO BRANCO DE ARAUJO,2021,https://portal.conasems.org.br/brasil-aqui-tem-sus/experiencias/1361_orientacoes-sobre-os-protocolos-de-atendimento-para-prevencao-da-covid-19-para-vendedores-de-alimentos-de-pequenas-bancas-e-carrinhos-de-mao-no-cntro-historico-e-adjacencias-em-sao-luis-ma
ATENDIMENTO DE PACIENTES PEDIÁTRICOS INTERNADOS NA ALA DE COVID-19 NO HOSPITAL DA CRIANÇA EM SÃO LUÍS/MA.  ,São Luís - MA,RAMONE LUCIANA SANTOS ARAúJO LOPES ,2021,https://portal.conasems.org.br/brasil-aqui-tem-sus/experiencias/1362_atendimento-de-pacientes-pediatricos-internados-na-ala-de-covid-19-no-hospital-da-crianca-em-sao-luis-ma
"Acompanhamento do uso de dietas especializadas via sonda enteral e/ou oral para complementação, no período do COVID 19",Alpinópolis - MG,ANA PAULA LIMA,2021,https://portal.conasems.org.br/brasil-aqui-tem-sus/experiencias/1385_acompanhamento-do-uso-de-dietas-especializadas-via-sonda-enteral-e-ou-oral-para-complementacao-no-periodo-do-covid-19
"SERVIÇO DE FISIOTERAPIA DO NASF EM PACIENTES QUE FAZEM USO DE OXIGÊNIO DOMICILIAR, NO PERÍODO DE PANDEMIA.",Alpinópolis - MG,EVELYNE SILVA LEMOS,2021,https://portal.conasems.org.br/brasil-aqui-tem-sus/experiencias/1399_servico-de-fisioterapia-do-nasf-em-pacientes-que-fazem-uso-de-oxigenio-domiciliar-no-periodo-de-pandemia
eQUIPE MULTIPROFISSIONAL DO SUS NO ENFRENTAMENTO DO CORONAVÍRUS,Araponga - MG,JAQUELINE PEREIRA LOPES,2021,https://portal.conasems.org.br/brasil-aqui-tem-sus/experiencias/1400_equipe-multiprofissional-do-sus-no-enfrentamento-do-coronavirus
A IMPORTÂNCIA DO RASTREAMENTO E MONITORAMENTO NO COMBATE A PANDEMIA COVID 19.,Araxá - MG,DIANE DUTRA CARDOSO BORGES,2021,https://portal.conasems.org.br/brasil-aqui-tem-sus/experiencias/1423_a-importancia-do-rastreamento-e-monitoramento-no-combate-a-pandemia-covid-19
ORGANIZAÇÃO E ESTRUTURAÇÃO DA REDE DE ATENÇÃO À SAÚDE DO MUNICÍPIO DE BARBACENA NO Enfrentamento à covid-19,Barbacena - MG,LUCIANO OTAVIO BAETA CHARTONE DE PAULA,2021,https://portal.conasems.org.br/brasil-aqui-tem-sus/experiencias/1401_organizacao-e-estruturacao-da-rede-de-atencao-a-saude-do-municipio-de-barbacena-no-enfrentamento-a-covid-19
Criação de um grupo em um aplicativo de troca de mensagens com os líderes comunitários e os agentes comunitários de saúde das comunidades rurais de Barbacena.,Barbacena - MG,LENA MáRCIA PACHECO,2021,https://portal.conasems.org.br/brasil-aqui-tem-sus/experiencias/1403_criacao-de-um-grupo-em-um-aplicativo-de-troca-de-mensagens-com-os-lideres-comunitarios-e-os-agentes-comunitarios-de-saude-das-comunidades-rurais-de-barbacena
Instrutivo para Atividade Laboral dos Sepultadores no Contexto da COVID-19.,Barbacena - MG,ANDRéA CRISTINA DE SOUZA E SILVA,2021,https://portal.conasems.org.br/brasil-aqui-tem-sus/experiencias/1402_instrutivo-para-atividade-laboral-dos-sepultadores-no-contexto-da-covid-19
"Atendimento psicológico, acolhimento e escuta profissional para os trabalhadores e
trabalhadoras da saúde com sintomas de transtornos mentais relacionados ao trabalho.",Barbacena - MG,REJANE MARIA LAMAS WUTKE,2021,https://portal.conasems.org.br/brasil-aqui-tem-sus/experiencias/1425_atendimento-psicologico-acolhimento-e-escuta-profissional-para-os-trabalhadores-e-trabalhadoras-da-saude-com-sintomas-de-transtornos-mentais-relacionados-ao-trabalho
"Proteção da carga física, emocional e psicológica gerada pela Covid 19 utilizando-se de
divulgações nas redes sociais de maior alcance em nossa região.",Barbacena - MG,GRAZIELA CAROLINE BERNINI,2021,https://portal.conasems.org.br/brasil-aqui-tem-sus/experiencias/1424_protecao-da-carga-fisica-emocional-e-psicologica-gerada-pela-covid-19-utilizando-se-de-divulgacoes-nas-redes-sociais-de-maior-alcance-em-nossa-regiao
"Implantação do serviço de acolhimento provisório e emergencial para a população em situação de rua (PSR), no enfrentamento da pandemia Covid-19 no município de Belo Horizonte, Minas Gerais",Belo Horizonte - MG,RENATA BERNARDES MASCARENHAS,2021,https://portal.conasems.org.br/brasil-aqui-tem-sus/experiencias/1389_implantacao-do-servico-de-acolhimento-provisorio-e-emergencial-para-a-populacao-em-situacao-de-rua-psr-no-enfrentamento-da-pandemia-covid-19-no-municipio-de-belo-horizonte-minas-gerais
Cuidado Integral ao idoso em acolhimento institucional no contexto da pandemia de COVID 19: Uma construção Intersetorial da Prefeitura de Belo Horizonte.,Belo Horizonte - MG,FABIANA RIBEIRO SILVA,2021,https://portal.conasems.org.br/brasil-aqui-tem-sus/experiencias/1388_cuidado-integral-ao-idoso-em-acolhimento-institucional-no-contexto-da-pandemia-de-covid-19-uma-construcao-intersetorial-da-prefeitura-de-belo-horizonte
A reorganização do processo de trabalho do Serviço de Atenção Domiciliar (SAD) de Belo Horizonte no enfrentamento a COVID-19,Belo Horizonte - MG,RAQUEL FELISARDO ROSA,2021,https://portal.conasems.org.br/brasil-aqui-tem-sus/experiencias/1390_a-reorganizacao-do-processo-de-trabalho-do-servico-de-atencao-domiciliar-sad-de-belo-horizonte-no-enfrentamento-a-covid-19
Observatório da rede de urgência em BH: Uso de Ferramentas de gestão aplicadas ao cuidado assistencial no enfrentamento a COVID 19,Belo Horizonte - MG,ALEX SANDER SENA PÉRES ,2021,https://portal.conasems.org.br/brasil-aqui-tem-sus/experiencias/1386_observatorio-da-rede-de-urgencia-em-bh-uso-de-ferramentas-de-gestao-aplicadas-ao-cuidado-assistencial-no-enfrentamento-a-covid-19
Implantação de Pontos de Fiscalização Sanitária em Belo Horizonte: Abordagem Integrada para o cuidado. ,Belo Horizonte - MG,TACIANA MALHEIROS LIMA CARVALHO,2021,https://portal.conasems.org.br/brasil-aqui-tem-sus/experiencias/1387_implantacao-de-pontos-de-fiscalizacao-sanitaria-em-belo-horizonte-abordagem-integrada-para-o-cuidado
Implantação do Centro Especializado em doenças respiratórias - CECOVID para o enfrentamento da Pandemia COVID 19 no município de Belo Horizonte.,Belo Horizonte - MG,KAREN GONçALVES NETO DE MATOS,2021,https://portal.conasems.org.br/brasil-aqui-tem-sus/experiencias/1404_implantacao-do-centro-especializado-em-doencas-respiratorias-cecovid-para-o-enfrentamento-da-pandemia-covid-19-no-municipio-de-belo-horizonte
O impacto emocional e os atravessamentos da pandemia COVID 19 na Saúde do Trabalhador.,Belo Horizonte - MG,THANIA EMILIA LANNA PEREIRA,2021,https://portal.conasems.org.br/brasil-aqui-tem-sus/experiencias/1426_o-impacto-emocional-e-os-atravessamentos-da-pandemia-covid-19-na-saude-do-trabalhador
SAÚDE ONLINE - USO DA TECNOLOGIA PARA REALIZAÇÃO DE GRUPOS OPERATIVOS E ATENDIMENTOS EM CARLOS CHAGAS-MG,Carlos Chagas - MG,RICARDO ALMEIDA VIANA,2021,https://portal.conasems.org.br/brasil-aqui-tem-sus/experiencias/1391_saude-online-uso-da-tecnologia-para-realizacao-de-grupos-operativos-e-atendimentos-em-carlos-chagas-mg
PROJETO CUIDAR DE QUEM CUIDA,Carlos Chagas - MG,NAYANNA MOURA PEREIRA ,2021,https://portal.conasems.org.br/brasil-aqui-tem-sus/experiencias/1392_projeto-cuidar-de-quem-cuida
REDE COLABORATIVA MUNICIPAL NO ENFRENTAMENTO A PANDEMIA PELO NOVO CORONAVIRUS EM CATAS ALTAS-MG,Catas Altas - MG,MARIA TEREZA PEREIRA HOSKEN,2021,https://portal.conasems.org.br/brasil-aqui-tem-sus/experiencias/1393_rede-colaborativa-municipal-no-enfrentamento-a-pandemia-pelo-novo-coronavirus-em-catas-altas-mg
A IMPORTÂNCIA DE REMODELAR OS SERVIÇOS DA ATENÇÃO PRIMÁRIA A SAÚDE PARA ENFRENTAMENTO DA PANDEMIA DE COVID-19 NO MUNICÍPIO DE CHAPADA DO NORTE/MG.,Chapada do Norte - MG,ANA RITA MACHADO,2021,https://portal.conasems.org.br/brasil-aqui-tem-sus/experiencias/1405_a-importancia-de-remodelar-os-servicos-da-atencao-primaria-a-saude-para-enfrentamento-da-pandemia-de-covid-19-no-municipio-de-chapada-do-norte-mg
"CESTINHA DA MOTIVAÇÃO 
LINHA DE FRENTE ESCUTAR CUIDAR MOTIVAR APOIAR
",Comendador Gomes - MG,DAIANE CRISTINE DE CARLIS PUGA,2021,https://portal.conasems.org.br/brasil-aqui-tem-sus/experiencias/1394_cestinha-da-motivacao-linha-de-frente-escutar-cuidar-motivar-apoiar
"PLANTÃO PSICOLÓGICO ONLINE:
 
ESTRATÉGIA POTENTE PARA O FORTALECIMENTO DO ACESSO AO DIREITO À ASSISTENCIA PSICOLÓGICA EM TEMPOS DE PANDEMIA EM COROMANDEL-MG.",Coromandel - MG,PATRICIA APARECIDA DA SILVA,2021,https://portal.conasems.org.br/brasil-aqui-tem-sus/experiencias/1427_plantao-psicologico-online-estrategia-potente-para-o-fortalecimento-do-acesso-ao-direito-a-assistencia-psicologica-em-tempos-de-pandemia-em-coromandel-mg
ALÔ CORONA: O TELEATENDIMENTO COMO DISPOSITIVO PARA A EDUCAÇÃO EM SAÚDE ,Divinópolis - MG,JOSEANE DA SILVA,2021,https://portal.conasems.org.br/brasil-aqui-tem-sus/experiencias/1395_alo-corona-o-teleatendimento-como-dispositivo-para-a-educacao-em-saude
Acesso com segurança: o cuidado das Farmácias Municipais em tempo de pandemia,Divinópolis - MG,ARIANE GARROCHO DE FARIA,2021,https://portal.conasems.org.br/brasil-aqui-tem-sus/experiencias/1428_acesso-com-seguranca-o-cuidado-das-farmacias-municipais-em-tempo-de-pandemia
"REALIZAÇÃO DE INQUÉRITO EPIDEMIOLÓGICO EM DORESÓPOLIS/MG, PARA APURAÇÃO MAIS DETALHADA DOS SUSPEITOS DE COVID-19",Doresópolis - MG,ROSANGELA APARECIDA TERRA E GUERRA ,2021,https://portal.conasems.org.br/brasil-aqui-tem-sus/experiencias/1396_realizacao-de-inquerito-epidemiologico-em-doresopolis-mg-para-apuracao-mais-detalhada-dos-suspeitos-de-covid-19
Promoção da acessibilidade da atenção primária em doresópolis durante a pandemia do novo coronavírus,Doresópolis - MG,IGOR FELLYPE CAMARGOS SILVA,2021,https://portal.conasems.org.br/brasil-aqui-tem-sus/experiencias/1406_promocao-da-acessibilidade-da-atencao-primaria-em-doresopolis-durante-a-pandemia-do-novo-coronavirus
IMPLANTAÇÃO DA CENTRAL DE MONITORAMENTO DA COVID-19 NO MUNICÍPIO DE ITABIRA - MG,Itabira - MG,LUIZ GUSTAVO CANTO RODRIGUES,2021,https://portal.conasems.org.br/brasil-aqui-tem-sus/experiencias/1407_implantacao-da-central-de-monitoramento-da-covid-19-no-municipio-de-itabira-mg
"TELEMONITORAMENTO/TELEORIENTAÇÃO EM
ODONTOLOGIA PARA PACIENTES PERTECENTES A GRUPO DE RISCO
",Itabirito - MG,MARINALVA FARIA BRAGA,2021,https://portal.conasems.org.br/brasil-aqui-tem-sus/experiencias/1408_telemonitoramento-teleorientacao-em-odontologia-para-pacientes-pertecentes-a-grupo-de-risco
PsiCOVID/Itajubá-MG – Apoio Psicológico para o enfrentamento da pandemia Covid 19,Itajubá - MG,AMANDA SUSI DA SILVA,2021,https://portal.conasems.org.br/brasil-aqui-tem-sus/experiencias/1409_psicovid-itajuba-mg-apoio-psicologico-para-o-enfrentamento-da-pandemia-covid-19
"As ações municipais de enfrentamento, prevenção e proteção à COVID-19 no município de Joaíma-MG. Um relato do cuidado com a população.

",Joaíma - MG,BETHANIA MACHADO DE MATOS SILVA,2021,https://portal.conasems.org.br/brasil-aqui-tem-sus/experiencias/1429_as-acoes-municipais-de-enfrentamento-prevencao-e-protecao-a-covid-19-no-municipio-de-joaima-mg-um-relato-do-cuidado-com-a-populacao
"DE PRINCESINHA À GUERREIRA: ESTRATÉGIA MUNICIPAL DE ENFRENTAMENTO À COVID-19 DE JURUAIA, MINAS GERAIS",Juruaia - MG,PAULO ADAIAS PIZA,2021,https://portal.conasems.org.br/brasil-aqui-tem-sus/experiencias/1430_de-princesinha-a-guerreira-estrategia-municipal-de-enfrentamento-a-covid-19-de-juruaia-minas-gerais
"Genograma e Ecomapa como ferramentas para ampliar o olhar da gestão, captar possíveis contatos de COVID-19, monitorar o agravamento de quadro clínico e traçar estratégias de ação.",Leopoldina - MG,MARIA EMILIA TEIXEIRA DE MORAES,2021,https://portal.conasems.org.br/brasil-aqui-tem-sus/experiencias/1413_genograma-e-ecomapa-como-ferramentas-para-ampliar-o-olhar-da-gestao-captar-possiveis-contatos-de-covid-19-monitorar-o-agravamento-de-quadro-clinico-e-tracar-estrategias-de-acao
Criação da Comissão de Apoio à Fiscalização de Posturas no combate ao novo coronavírus: implementação e manutenção das medidas restritivas.,Leopoldina - MG,MARCIO VIEIRA MACHADO,2021,https://portal.conasems.org.br/brasil-aqui-tem-sus/experiencias/1411_criacao-da-comissao-de-apoio-a-fiscalizacao-de-posturas-no-combate-ao-novo-coronavirus-implementacao-e-manutencao-das-medidas-restritivas
Utilização de estratégias de gerenciamento de crise pelo Comitê Municipal de Enfrentamento da COVID-19 no município de Leopoldina-MG: conhecer para controlar!,Leopoldina - MG,VINICIUS FRANZONI BARBOSA FERREIRA,2021,https://portal.conasems.org.br/brasil-aqui-tem-sus/experiencias/1412_utilizacao-de-estrategias-de-gerenciamento-de-crise-pelo-comite-municipal-de-enfrentamento-da-covid-19-no-municipio-de-leopoldina-mg-conhecer-para-controlar
Uso das mídias no combate a Infodemia da COVID-19: informações corretas e oportunas que salvam vidas.,Leopoldina - MG,ELISA,2021,https://portal.conasems.org.br/brasil-aqui-tem-sus/experiencias/1410_uso-das-midias-no-combate-a-infodemia-da-covid-19-informacoes-corretas-e-oportunas-que-salvam-vidas
cuidar de Quem Cuida: acolhimento psicológico aos profissionais de saúde no enfrentamento à COVID-19 em Montes Claros/MG,Montes Claros - MG,NIEDE NICA MACHADO AFONSO,2021,https://portal.conasems.org.br/brasil-aqui-tem-sus/experiencias/1415_cuidar-de-quem-cuida-acolhimento-psicologico-aos-profissionais-de-saude-no-enfrentamento-a-covid-19-em-montes-claros-mg
Implantação da Sala de Situação COVID-19 no município de Montes Claros/MG. ,Montes Claros - MG,TATIANA ALMEIDA DE MAGALHÃES,2021,https://portal.conasems.org.br/brasil-aqui-tem-sus/experiencias/1414_implantacao-da-sala-de-situacao-covid-19-no-municipio-de-montes-claros-mg
Ações integradas de vigilância em saúde no enfrentamento à COVID-9 no município de Montes Claros/MG. ,Montes Claros - MG,MARA DAISY ALVES RIBEIRO,2021,https://portal.conasems.org.br/brasil-aqui-tem-sus/experiencias/1416_acoes-integradas-de-vigilancia-em-saude-no-enfrentamento-a-covid-9-no-municipio-de-montes-claros-mg
CADASTRO VOLUNTÁRIO DE ATENDIMENTO - MÓDULO CIDADÃO / MÓDULO EQUIPE DE SAÚDE / MÓDULO GESTOR,Nova Resende - MG,MARA AVELAR FLORIO,2021,https://portal.conasems.org.br/brasil-aqui-tem-sus/experiencias/1417_cadastro-voluntario-de-atendimento-modulo-cidadao-modulo-equipe-de-saude-modulo-gestor
BRIGADA DE ENFRENTAMENTO QUE ACOMPANHARÁ AS MEDIDAS DE PREVENÇÃO E CONTINGENCIAMENTO EM SAÚDE A COVID-19 (NOVO CORONAVÍRUS) NO MUNICÍPIO DE PASSOS -MG,Passos - MG,GLEIDA DIAS SOUZA,2021,https://portal.conasems.org.br/brasil-aqui-tem-sus/experiencias/1418_brigada-de-enfrentamento-que-acompanhara-as-medidas-de-prevencao-e-contingenciamento-em-saude-a-covid-19-novo-coronavirus-no-municipio-de-passos-mg
CUIDANDO DE QUEM CUIDA ATRAVÉS DE PRÁTICAS INTEGRATIVAS,Passos - MG,ANDREA BORGES LOPES,2021,https://portal.conasems.org.br/brasil-aqui-tem-sus/experiencias/1419_cuidando-de-quem-cuida-atraves-de-praticas-integrativas
SETOR DE COMUNICAÇÃO E MOBILIZAÇÃO SOCIAL APLICADO À VIGILÂNCIA EM SAÚDE: A INTERSETORIALIDADE NO ENFRENTAMENTO AO CORONAVÍRUS EM PEDRA AZUL (MG),Pedra Azul - MG,LUIZA COSTA TANURE ,2021,https://portal.conasems.org.br/brasil-aqui-tem-sus/experiencias/1397_setor-de-comunicacao-e-mobilizacao-social-aplicado-a-vigilancia-em-saude-a-intersetorialidade-no-enfrentamento-ao-coronavirus-em-pedra-azul-mg
AÇÕES DE GESTÃO PARA ORGANIZAÇÃO DA REDE DE ATENÇÃO À SAÚDE do município de pirapora FRENTE À PANDEMIA POR CORONAVÍRUS – UM RELATO DE EXPERIÊNCIA,Pirapora - MG,MARIA CANDIDA FIUZA COSTA QUEIROZ,2021,https://portal.conasems.org.br/brasil-aqui-tem-sus/experiencias/1398_acoes-de-gestao-para-organizacao-da-rede-de-atencao-a-saude-do-municipio-de-pirapora-frente-a-pandemia-por-coronavirus-um-relato-de-experiencia
"PLANO DE ORIENTAÇÃO AOS CONTRATANTES DE SAFRISTAS MIGRANTES, DIANTE DA PANDEMIA DO COVID-19.",Piumhi - MG,KEILA DAYANE COSTA PEREIRA,2021,https://portal.conasems.org.br/brasil-aqui-tem-sus/experiencias/1431_plano-de-orientacao-aos-contratantes-de-safristas-migrantes-diante-da-pandemia-do-covid-19
meditação no enfrentamento da pandemia do coronavírus,Piumhi - MG,MARISA DE FATIMA FERREIRA,2021,https://portal.conasems.org.br/brasil-aqui-tem-sus/experiencias/1432_meditacao-no-enfrentamento-da-pandemia-do-coronavirus
Atendimento domiciliar: estratégia de manutenção dos serviços de saúde em Porto Firme (MG),Porto Firme - MG,PATRICK MACIEL TORRES,2021,https://portal.conasems.org.br/brasil-aqui-tem-sus/experiencias/1433_atendimento-domiciliar-estrategia-de-manutencao-dos-servicos-de-saude-em-porto-firme-mg
Saúde Mental na Janela: registro fotográfico de usuários da Oficina Sempre Viva em tempos da pandemia da COVID-19,Presidente Kubitschek - MG,ARYANE MARTINS LOPES,2021,https://portal.conasems.org.br/brasil-aqui-tem-sus/experiencias/1434_saude-mental-na-janela-registro-fotografico-de-usuarios-da-oficina-sempre-viva-em-tempos-da-pandemia-da-covid-19
Redes Sociais como aliadas na luta contra a covid 19 - fonte de informação e combate à desinformação da população riocasquense.  ,Rio Casca - MG,CRISLAINE CUSTODIA ROSA,2021,https://portal.conasems.org.br/brasil-aqui-tem-sus/experiencias/1420_redes-sociais-como-aliadas-na-luta-contra-a-covid-19-fonte-de-informacao-e-combate-a-desinformacao-da-populacao-riocasquense
Plano de Reorganização da Saúde Bucal na Atenção Básica no Município de Rio Casca - MG,Rio Casca - MG,BRUNA SILVA CARVALHO,2021,https://portal.conasems.org.br/brasil-aqui-tem-sus/experiencias/1436_plano-de-reorganizacao-da-saude-bucal-na-atencao-basica-no-municipio-de-rio-casca-mg
" Atividade física para idosos na pandemia - qualidade de vida e saúde mental
",Rio Casca - MG,ANA MARIA SILVA REIS,2021,https://portal.conasems.org.br/brasil-aqui-tem-sus/experiencias/1435_atividade-fisica-para-idosos-na-pandemia-qualidade-de-vida-e-saude-mental
ATENÇÃO AO PORTADO DE COVID-19 NA REDE DE ATENÇÃO A SAÚDE,Santo Antônio do Monte - MG,CARLA LORENA SANTOS ,2021,https://portal.conasems.org.br/brasil-aqui-tem-sus/experiencias/1421_atencao-ao-portado-de-covid-19-na-rede-de-atencao-a-saude
SERESTA: CUIDADO EM TEMPOS DE ISOLAMENTO SOCIAL – PROJETO DA PREFEITURA DE SÃO JOSÉ DA LAPA / MG,São José da Lapa - MG,ADRIANA PRUDENTE DA SILVA,2021,https://portal.conasems.org.br/brasil-aqui-tem-sus/experiencias/1437_seresta-cuidado-em-tempos-de-isolamento-social-projeto-da-prefeitura-de-sao-jose-da-lapa-mg
PALAVRAS AO CORAÇÃO: PROJETO DO MUNICÍPIO DE SÃO JOSÉ DA LAPA,São José da Lapa - MG,LUCIANA LATORRE GALVES OLIVEIRA,2021,https://portal.conasems.org.br/brasil-aqui-tem-sus/experiencias/1438_palavras-ao-coracao-projeto-do-municipio-de-sao-jose-da-lapa
CUIDANDO DO PROFISSIONAL DO SETOR SAÚDE NA PANDEMIA,Tabuleiro - MG,EDILAINE APARECIDA DOS REIS,2021,https://portal.conasems.org.br/brasil-aqui-tem-sus/experiencias/1422_cuidando-do-profissional-do-setor-saude-na-pandemia
Projeto Ser Saudável Autocuidado também é amor-próprio!,Varginha - MG,RODOLFO DE OLIVEIRA RAIMUNDO,2021,https://portal.conasems.org.br/brasil-aqui-tem-sus/experiencias/1439_projeto-ser-saudavel-autocuidado-tambem-e-amor-proprio
CORONAZERO: Gestão Epidemiológica Baseada em Tecnologia e Dados,Viçosa - MG,MARCUS ANTONIO AMARANTE VIANA SCHITINI,2021,https://portal.conasems.org.br/brasil-aqui-tem-sus/experiencias/1440_coronazero-gestao-epidemiologica-baseada-em-tecnologia-e-dados
"SISTEMA DE AUXÍLIO NA TRIAGEM PARA A COVID-19 - MÓDULOS:
CIDADÃO E MÉDICO",Campo Grande - MS,PAULO FERNANDO GARCIA CARDOSO,2021,https://portal.conasems.org.br/brasil-aqui-tem-sus/experiencias/1381_sistema-de-auxilio-na-triagem-para-a-covid-19-modulos-cidadao-e-medico
TELEMONITORAMENTO VIA WHATSAPP,Campo Grande - MS,BRUNO AUGUSTO GONCALVES DOS REIS,2021,https://portal.conasems.org.br/brasil-aqui-tem-sus/experiencias/1382_telemonitoramento-via-whatsapp
"REFISME/COVID - GRUPO REMOTO DE REABILITAÇÃO, FÍSICA, MENTAL E EMOCIONAL.",Campo Grande - MS,ALANA GISELE GALEANO,2021,https://portal.conasems.org.br/brasil-aqui-tem-sus/experiencias/1384_refisme-covid-grupo-remoto-de-reabilitacao-fisica-mental-e-emocional
PROCESSO DE DESCENTRALIZAÇÃO DO ACOMPANHAMENTO E CUIDADO DE PACIENTES CONFIRMADOS COM COVID-19 E SEUS CONTATOS NO MUNICÍPIO DE TRÊS LAGOAS: A IMPORTÂNCIA DA ATENÇÃO PRIMÁRIA À SAÚDE,Três Lagoas - MS,VINíCIUS DE JESUS RODRIGUES NEVES,2021,https://portal.conasems.org.br/brasil-aqui-tem-sus/experiencias/1383_processo-de-descentralizacao-do-acompanhamento-e-cuidado-de-pacientes-confirmados-com-covid-19-e-seus-contatos-no-municipio-de-tres-lagoas-a-importancia-da-atencao-primaria-a-saude
