titulo,cidade_estado,autoria,ano,link_experiencia
“Saúde em Alerta Videira. Juntos contra o coronavírus”,Videira - SC,EVERTON TURKE,2021,https://portal.conasems.org.br/brasil-aqui-tem-sus/experiencias/1704_saude-em-alerta-videira-juntos-contra-o-coronavirus
"SERVIÇO DE APOIO PSICOLÓGICO REMOTO (SAPSI) – EXPERIÊNCIA DE IMPLANTAÇÃO DE SERVIÇO DE SUPORTE PSICOLÓGICO POR TELEFONE, COMO PARTE DAS AÇÕES DE ENFRENTAMENTO A COVID-19, NO MUNICÍPIO DE ARACAJU/SE.",Aracaju - SE,CHENYA VALENÇA COUTINHO,2021,https://portal.conasems.org.br/brasil-aqui-tem-sus/experiencias/1796_servico-de-apoio-psicologico-remoto-sapsi-experiencia-de-implantacao-de-servico-de-suporte-psicologico-por-telefone-como-parte-das-acoes-de-enfrentamento-a-covid-19-no-municipio-de-aracaju-se
UNIDADES DE SAÚDE DA FAMÍLIA (USF) COMO REFERÊNCIA NO ATENDIMENTO DE PESSOAS COM QUADRO DE SÍNDROME GRIPAL: COLABORAÇÃO NA DIMINUIÇÃO DE DEMANDA NAS URGÊNCIAS DE ARACAJU DURANTE A PANDEMIA DE COVID-19,Aracaju - SE,CARLOS NORONHA NETO,2021,https://portal.conasems.org.br/brasil-aqui-tem-sus/experiencias/1797_unidades-de-saude-da-familia-usf-como-referencia-no-atendimento-de-pessoas-com-quadro-de-sindrome-gripal-colaboracao-na-diminuicao-de-demanda-nas-urgencias-de-aracaju-durante-a-pandemia-de-covid-19
PLANEJAMENTO ESTRATÉGICO: FERRAMENTA DE GESTÃO PRIMORDIAL NA ORGANIZAÇÃO COM EFICIÊNCIA DO ENFRENTAMENTO DA PANDEMIA DE COVID 19 EM ARACAJU /SE,Aracaju - SE,TAISE FERREIRA CAVALCANTE,2021,https://portal.conasems.org.br/brasil-aqui-tem-sus/experiencias/1795_planejamento-estrategico-ferramenta-de-gestao-primordial-na-organizacao-com-eficiencia-do-enfrentamento-da-pandemia-de-covid-19-em-aracaju-se
Aracaju Pela Vida: como a busca ativa de pacientes sintomáticos com potencial para agravamento influenciou na diminuição dos óbitos por COVID-19 em Aracaju,Aracaju - SE,ANA REGIA OLIVEIRA DE ANDRADE,2021,https://portal.conasems.org.br/brasil-aqui-tem-sus/experiencias/1801_aracaju-pela-vida-como-a-busca-ativa-de-pacientes-sintomaticos-com-potencial-para-agravamento-influenciou-na-diminuicao-dos-obitos-por-covid-19-em-aracaju
TRATANDO A SAÚDE FÍSICA E MENTAL DOS USUÁRIOS DO CAPS I E FAMILIARES EM TEMPO DE PANDEMIA.,Barra dos Coqueiros - SE,ZELMA DE LOURDES RIBEIRO FERREIRA ANDRADE,2021,https://portal.conasems.org.br/brasil-aqui-tem-sus/experiencias/1802_tratando-a-saude-fisica-e-mental-dos-usuarios-do-caps-i-e-familiares-em-tempo-de-pandemia
"PROMOÇÃO DE SAÚDE MENTAL E MANUTENÇÃO DE VÍNCULO ENTRE USUÁRIO E EQUIPE DO CAPS.  

",Carira - SE,MARIA GRAZIELA GOMES ALVES ,2021,https://portal.conasems.org.br/brasil-aqui-tem-sus/experiencias/1798_promocao-de-saude-mental-e-manutencao-de-vinculo-entre-usuario-e-equipe-do-caps
 “ CEDROTEST: diagnosticando para cuidar ”,Cedro de São João - SE,MARÍLIA,2021,https://portal.conasems.org.br/brasil-aqui-tem-sus/experiencias/1799_cedrotest-diagnosticando-para-cuidar
A ORGANIZAÇÃO DOS PROCESSOS DE TRABALHO NA ATENÇÃO PRIMÁRIA À SAÚDE E A DEFINIÇÃO DOS FLUXOS DE ATENDIMENTO NO MUNICÍPIO DE DIVINA PASTORA/SE PARA O ENFRENTAMENTO DA PANDEMIA DO NOVO CORONAVÍRUS.,Divina Pastora - SE,ANA LÍDIA NASCIMENTO DE BARROS,2021,https://portal.conasems.org.br/brasil-aqui-tem-sus/experiencias/1789_a-organizacao-dos-processos-de-trabalho-na-atencao-primaria-a-saude-e-a-definicao-dos-fluxos-de-atendimento-no-municipio-de-divina-pastora-se-para-o-enfrentamento-da-pandemia-do-novo-coronavirus
"ENFRENTANDO A COVID-19 À LUZ DOS PRINCÍPIOS DA EDUCAÇÃO POPULAR EM SAÚDE: EXPERIÊNCIAS VIVENCIADAS PELOS AGENTES COMUNITÁRIOS DE SAÚDE DA UNIDADE BÁSICA DE SAÚDE DO BAIRRO SÃO CRISTÓVÃO, ITABAIANA/SE ",Itabaiana - SE,MANOEL MESSIAS DE MENDONçA,2021,https://portal.conasems.org.br/brasil-aqui-tem-sus/experiencias/1800_enfrentando-a-covid-19-a-luz-dos-principios-da-educacao-popular-em-saude-experiencias-vivenciadas-pelos-agentes-comunitarios-de-saude-da-unidade-basica-de-saude-do-bairro-sao-cristovao-itabaiana-se
REABILITAÇÃO DOMICILIAR DO PACIENTE COM COVID-19 ATIVA E APÓS ALTA: NÍVEL DE CONHECIMENTO E CAPACITAÇÃO DOS PROFISSIONAIS DAS EQUIPES DE SAÚDE DA FAMÍLIA,Itabaiana - SE,FERNANDA MENDONçA ARAúJO,2021,https://portal.conasems.org.br/brasil-aqui-tem-sus/experiencias/1804_reabilitacao-domiciliar-do-paciente-com-covid-19-ativa-e-apos-alta-nivel-de-conhecimento-e-capacitacao-dos-profissionais-das-equipes-de-saude-da-familia
CENTRO DE ATENDIMENTO PARA ENFRENTAMENTO À COVID-19 NO MUNICÍPIO DE ITABAIANA-SE: UMA VISÃO PRECEDENTE,Itabaiana - SE,PATRICIA MENDONÇA DE ARAUJO,2021,https://portal.conasems.org.br/brasil-aqui-tem-sus/experiencias/1803_centro-de-atendimento-para-enfrentamento-a-covid-19-no-municipio-de-itabaiana-se-uma-visao-precedente
"CONTINUE A NADAR: JUNTOS SOMOS MAIS FORTES
",Nossa Senhora do Socorro - SE,MONICA REGINA TRINDADE SANTOS,2021,https://portal.conasems.org.br/brasil-aqui-tem-sus/experiencias/1790_continue-a-nadar-juntos-somos-mais-fortes
"RECOMEÇAR: UMA NOVA ABORDAGEM NA ASSISTÊNCIA AOS USUÁRIOS DO NASF-AB, EM MEIO AO ENFRENTAMENTO DA PANDEMIA DO CORONAVÍRUS",Nossa Senhora do Socorro - SE,VANESSA NASCIMENTO GOES ,2021,https://portal.conasems.org.br/brasil-aqui-tem-sus/experiencias/1805_recomecar-uma-nova-abordagem-na-assistencia-aos-usuarios-do-nasf-ab-em-meio-ao-enfrentamento-da-pandemia-do-coronavirus
ATENÇÃO PRIMÁRIA À SAÚDE NO COMBATE À PANDEMIA NO MUNICÍPIO DE POÇO VERDE/SE: UMA ESTRATÉGIA DE REORGANIZAÇÃO DOS PROCESSOS DE TRABALHO,Poço Verde - SE,AFONSO ABREU MENDES JUNIOR ,2021,https://portal.conasems.org.br/brasil-aqui-tem-sus/experiencias/1791_atencao-primaria-a-saude-no-combate-a-pandemia-no-municipio-de-poco-verde-se-uma-estrategia-de-reorganizacao-dos-processos-de-trabalho
"Central de Atendimento Disk Corona como ferramenta para o enfrentamento da COVID-19, no Município de Simão Dias/Se",Simão Dias - SE,PAULO BATISTA DOS SANTOS FILHO,2021,https://portal.conasems.org.br/brasil-aqui-tem-sus/experiencias/1793_central-de-atendimento-disk-corona-como-ferramenta-para-o-enfrentamento-da-covid-19-no-municipio-de-simao-dias-se
"Manejo clínico de corpos no contexto da COVID-19, uma iniciativa da gestão municipal na educação permanente de profissionais de saúde",Simão Dias - SE,GRAZIELA SANTANA SIQUEIRA,2021,https://portal.conasems.org.br/brasil-aqui-tem-sus/experiencias/1792_manejo-clinico-de-corpos-no-contexto-da-covid-19-uma-iniciativa-da-gestao-municipal-na-educacao-permanente-de-profissionais-de-saude
A IMPORTÂNCIA DA AÇÃO JUNINA COM MÚSICA PARA CUIDADORES E PACIENTES ACOMPANHADOS PELO PROGRAMA MELHOR EM CASA TOBIAS BARRETO/SE EM ÉPOCA DE COVID-19.,Tobias Barreto - SE,MáRCIA REGINA BATISTA  SANTANA MACEDO,2021,https://portal.conasems.org.br/brasil-aqui-tem-sus/experiencias/1794_a-importancia-da-acao-junina-com-musica-para-cuidadores-e-pacientes-acompanhados-pelo-programa-melhor-em-casa-tobias-barreto-se-em-epoca-de-covid-19
" 
MEDICINA TRADICIONAL CHINESA NOS CUIDADOS DAS SEQUELAS PÓS COVID-19: Experiências vivenciadas",Tobias Barreto - SE,ANA LúCIA VILANOVA FRANçA ,2021,https://portal.conasems.org.br/brasil-aqui-tem-sus/experiencias/1806_medicina-tradicional-chinesa-nos-cuidados-das-sequelas-pos-covid-19-experiencias-vivenciadas
Araraquara - menor taxa de letalidade por covid-19 do estado de são Paulo,Araraquara - SP,ELIANA APARECIDA MORI HONAIN,2021,https://portal.conasems.org.br/brasil-aqui-tem-sus/experiencias/1722_araraquara-menor-taxa-de-letalidade-por-covid-19-do-estado-de-sao-paulo
REORGANIZAÇÃO DO PROCESSO DE TRABALHO EM SAÚDE BUCAL NO SUS DURANTE A PANDEMIA DA COVID-19.,Araçatuba - SP,JOãO GABRIEL PAULINO MAZZON,2021,https://portal.conasems.org.br/brasil-aqui-tem-sus/experiencias/1721_reorganizacao-do-processo-de-trabalho-em-saude-bucal-no-sus-durante-a-pandemia-da-covid-19
"INTEGRAÇÃO ENTRE VIGILÂNCIA EM SAÚDE E ATENÇÃO BÁSICA COMO ESTRATÉGIA DE PREVENÇÃO AO CORONAVÍRUS NO MUNICÍPIO DE ARAÇATUBA,SP",Araçatuba - SP,TALITA CAROLINA BRAGANçA DE OLIVEIRA,2021,https://portal.conasems.org.br/brasil-aqui-tem-sus/experiencias/1762_integracao-entre-vigilancia-em-saude-e-atencao-basica-como-estrategia-de-prevencao-ao-coronavirus-no-municipio-de-aracatuba-sp
VIRALIZANDO INFORMAÇÕES EM SAÚDE: COMO CONVENCER A POPULAÇÃO SOBRE A PANDEMIA COVID?,Campinas - SP,TANIELLA CARVALHO MENDES,2021,https://portal.conasems.org.br/brasil-aqui-tem-sus/experiencias/1723_viralizando-informacoes-em-saude-como-convencer-a-populacao-sobre-a-pandemia-covid
PROTEÇÃO PARA TODOS: PRODUÇÃO E DOAÇÃO DE MÁSCARAS CASEIRAS PELA EQUIPE DO CENTRO DE SAÚDE VISTA ALEGRE,Campinas - SP,ADRIANE CLARINDO RODRIGUES,2021,https://portal.conasems.org.br/brasil-aqui-tem-sus/experiencias/1746_protecao-para-todos-producao-e-doacao-de-mascaras-caseiras-pela-equipe-do-centro-de-saude-vista-alegre
vivência de profissionais de saúde de uma unidade básica no enfrentamento apoiado da pandemia de covid-19: relato de experiência.,Diadema - SP,KARINA BERNARDINO DA SILVA,2021,https://portal.conasems.org.br/brasil-aqui-tem-sus/experiencias/1763_vivencia-de-profissionais-de-saude-de-uma-unidade-basica-no-enfrentamento-apoiado-da-pandemia-de-covid-19-relato-de-experiencia
IMPORTÂNCIA DA IMPLANTAÇÃO DA ESTRATIFICAÇÃO DE RISCO PARA ATENDER  PACIENTES  COM DOENÇAS CRÔNICAS NO ENFRENTAMENTO AO COVID 19 NO MUNICÍPIO DE FERNÃO/SP ,Fernão - SP,ELIANE JAQUELINE LOPES,2021,https://portal.conasems.org.br/brasil-aqui-tem-sus/experiencias/1749_importancia-da-implantacao-da-estratificacao-de-risco-para-atender-pacientes-com-doencas-cronicas-no-enfrentamento-ao-covid-19-no-municipio-de-fernao-sp
O ENFRENTAMENTO DAS OFICINAS TERAPÊUTICAS  DA UNIDADE DE SAÚDE DA FAMÍLIA DE FERNÃO DIANTE  DA PANDEMIA COVID-19 – UTILIZANDO O FAZER COMO EFEITO TERAPÊUTICO.,Fernão - SP,ROSA MARIA DEL´VESCOVO ,2021,https://portal.conasems.org.br/brasil-aqui-tem-sus/experiencias/1747_o-enfrentamento-das-oficinas-terapeuticas-da-unidade-de-saude-da-familia-de-fernao-diante-da-pandemia-covid-19-utilizando-o-fazer-como-efeito-terapeutico
A IMPORTÂNCIA DA SAÚDE E SEGURANÇA DOS PROFISSIONAIS DA LINHA DE FRENTE NO ENFRENTAMENTO A PANDEMIA COVID-19,Fernão - SP,VANESSA MARTINS,2021,https://portal.conasems.org.br/brasil-aqui-tem-sus/experiencias/1748_a-importancia-da-saude-e-seguranca-dos-profissionais-da-linha-de-frente-no-enfrentamento-a-pandemia-covid-19
CURSO CLÍNICO DOS PACIENTES INTERNADOS COM A COVID19 NO HOSPITAL PÚBLICO DOUTOR OSÍRIS FLORINDO COELHO DO ALTO TIETÊ SÃO PAULO.,Ferraz de Vasconcelos - SP,ELIANA SANTOS DA SILVA,2021,https://portal.conasems.org.br/brasil-aqui-tem-sus/experiencias/1764_curso-clinico-dos-pacientes-internados-com-a-covid19-no-hospital-publico-doutor-osiris-florindo-coelho-do-alto-tiete-sao-paulo
REORGANIZAÇÃO DA REDE DE ATENÇÃO À SAÚDE NO ENFRENTAMENTO DA PANDEMIA: OS DESAFIOS NA MITIGAÇÃO DA COVID -19 E A NECESSIDADE DE MANUTENÇÃO DE TODOS OS PONTOS DE ATENÇÃO.,Guararema - SP,ADRIANA MARTINS DE PAULA,2021,https://portal.conasems.org.br/brasil-aqui-tem-sus/experiencias/1766_reorganizacao-da-rede-de-atencao-a-saude-no-enfrentamento-da-pandemia-os-desafios-na-mitigacao-da-covid-19-e-a-necessidade-de-manutencao-de-todos-os-pontos-de-atencao
Campanha de vacinação de Influenza para o grupo prioritário de idosos: O desafio de promover o isolamento social e garantir a imunização,Guararema - SP,MARIA CARLA MUNIZ SCHMIDT,2021,https://portal.conasems.org.br/brasil-aqui-tem-sus/experiencias/1765_campanha-de-vacinacao-de-influenza-para-o-grupo-prioritario-de-idosos-o-desafio-de-promover-o-isolamento-social-e-garantir-a-imunizacao
"Distanciamento  e controle de Equipamento de Proteção Individual ( EPIs) como forma de prevenção ao COVID-19, saúde e segurança do trabalhador na Unidade Básica de Saúde",Guarulhos - SP,ILLORA ASWINKUMAR DARBAR SHIMOZATO,2021,https://portal.conasems.org.br/brasil-aqui-tem-sus/experiencias/1724_distanciamento-e-controle-de-equipamento-de-protecao-individual-epis-como-forma-de-prevencao-ao-covid-19-saude-e-seguranca-do-trabalhador-na-unidade-basica-de-saude
Coral como ferramenta de enfrentamento ao COVID-19 para os profissionais de saúde,Guarulhos - SP,LARISSA FERNANDA DOS PASSOS PARIS,2021,https://portal.conasems.org.br/brasil-aqui-tem-sus/experiencias/1725_coral-como-ferramenta-de-enfrentamento-ao-covid-19-para-os-profissionais-de-saude
Aplicação da Avaliação Multidimensional da Pessoa Idosa através de teleatendimento da equipe Nasf durante a pandemia de Covid 19 ,Guarulhos - SP,LUCIANA MIRANDA,2021,https://portal.conasems.org.br/brasil-aqui-tem-sus/experiencias/1767_aplicacao-da-avaliacao-multidimensional-da-pessoa-idosa-atraves-de-teleatendimento-da-equipe-nasf-durante-a-pandemia-de-covid-19
Ações de enfrentamento a pandemia de COVID-19 voltadas aos Povos Indígenas de Guarulhos: uma parceria entre Secretaria Municipal da Saúde e Instituto Butantan,Guarulhos - SP,ALICE APARECIDA DOS SANTOS,2021,https://portal.conasems.org.br/brasil-aqui-tem-sus/experiencias/1770_acoes-de-enfrentamento-a-pandemia-de-covid-19-voltadas-aos-povos-indigenas-de-guarulhos-uma-parceria-entre-secretaria-municipal-da-saude-e-instituto-butantan
O USO DE JOGOS COMO ESTRATÉGIA DE EDUCAÇÃO PERMANENTE EM UNIDADES BÁSICAS DE SAÚDE DA REGIÃO PIMENTAS-CUMBICA EM GUARULHOS/SP.,Guarulhos - SP,MARIANE FERRAZ DAMASCENO OLIVEIRA,2021,https://portal.conasems.org.br/brasil-aqui-tem-sus/experiencias/1768_o-uso-de-jogos-como-estrategia-de-educacao-permanente-em-unidades-basicas-de-saude-da-regiao-pimentas-cumbica-em-guarulhos-sp
"PERCEBA O RISCO, PROTEJA A VIDA-  AÇÃO INTEGRADA com BLITZ EDUCATIVAS E PREVENÇÃO DO COVID 19",Guarulhos - SP,MAGDA CARVALHO DE OLIVEIRA,2021,https://portal.conasems.org.br/brasil-aqui-tem-sus/experiencias/1769_perceba-o-risco-proteja-a-vida-acao-integrada-com-blitz-educativas-e-prevencao-do-covid-19
AÇÕES DESENVOLVIDAS PELOS DEPARTAMENTOS DE VIGILÂNCIA SANITÁRIA E VIGILÂNCIA EPIDEMIOLÓGICA NO COMBATE E CONTROLE DO SURTO DE COVID-19 EM INSTITUIÇÃO DE LONGA PERMANÊNCIA DE IDOSOS (ILPI),Hortolândia - SP,SAMIRA DE CARVALHO VICENTE,2021,https://portal.conasems.org.br/brasil-aqui-tem-sus/experiencias/1726_acoes-desenvolvidas-pelos-departamentos-de-vigilancia-sanitaria-e-vigilancia-epidemiologica-no-combate-e-controle-do-surto-de-covid-19-em-instituicao-de-longa-permanencia-de-idosos-ilpi
monitoramento clínico a distância de pacientes com covid-19 : protocolo instituído no município de jales. ,Jales - SP,ADRIANA MARIA JORGE DAL ACQUA PLATES,2021,https://portal.conasems.org.br/brasil-aqui-tem-sus/experiencias/1727_monitoramento-clinico-a-distancia-de-pacientes-com-covid-19-protocolo-instituido-no-municipio-de-jales
" AS EXPERIENCIAS DAS AÇOES DE ORIENTAÇÃO, REGULAÇÃO E COMUNICAÇÃO  DO MUNICIPIO DE VARZEA PAULISTA/SP NO ENFRENTAMENTO DA COVID-19",Jundiaí - SP,HELENA CRISTINA ALVES DE OLIVEIRA,2021,https://portal.conasems.org.br/brasil-aqui-tem-sus/experiencias/1771_as-experiencias-das-acoes-de-orientacao-regulacao-e-comunicacao-do-municipio-de-varzea-paulista-sp-no-enfrentamento-da-covid-19
"Planejar e articular, para enfrentar a pandemia",Lençóis Paulista - SP,SANDRA ESTER ALVES,2021,https://portal.conasems.org.br/brasil-aqui-tem-sus/experiencias/1728_planejar-e-articular-para-enfrentar-a-pandemia
"O desafio da Notificação, avaliação, e acompanhamento da doença em tempos de Pandemia",Lençóis Paulista - SP,ROSANGELA RIBEIRO,2021,https://portal.conasems.org.br/brasil-aqui-tem-sus/experiencias/1772_o-desafio-da-notificacao-avaliacao-e-acompanhamento-da-doenca-em-tempos-de-pandemia
Projeto alcance: uma experiência de monitoramento e atendimento em saúde mental aos pacientes em isolamento domiciliar da cidade de mairiporã,Mairiporã - SP,MARINA CLAUDIA NUNES DA COSTA,2021,https://portal.conasems.org.br/brasil-aqui-tem-sus/experiencias/1729_projeto-alcance-uma-experiencia-de-monitoramento-e-atendimento-em-saude-mental-aos-pacientes-em-isolamento-domiciliar-da-cidade-de-mairipora
AÇÕES DO MUNICÍPIO DE MAIRIPORÃ PARA MANUTENÇÃO DE TERAPÊUTICA MEDICAMENTOSA PARA PACIENTES EM USO DE PSICOTRÓPICOS DURANTE A PANDEMIA DE SARS-COV2,Mairiporã - SP,CLAUDIA CHAVES DALLELUCCI,2021,https://portal.conasems.org.br/brasil-aqui-tem-sus/experiencias/1773_acoes-do-municipio-de-mairipora-para-manutencao-de-terapeutica-medicamentosa-para-pacientes-em-uso-de-psicotropicos-durante-a-pandemia-de-sars-cov2
CUIDADO EM SAÚDE MENTAL COM O TRABALHADOR DA SAÚDE DURANTE A PANDEMIA DE SARS-COV2 NO MUNICÍPIO DE MAIRIPORÃ: ESPAÇO DE ESCUTA,Mairiporã - SP,ANGELA HERMíNIA MICHELINA TUCCI,2021,https://portal.conasems.org.br/brasil-aqui-tem-sus/experiencias/1774_cuidado-em-saude-mental-com-o-trabalhador-da-saude-durante-a-pandemia-de-sars-cov2-no-municipio-de-mairipora-espaco-de-escuta
"Título: O trabalho da psicologia na equipe multiprofissional no Hospital de Campanha de Mogi das Cruzes, SP: a integralidade do cuidado ao paciente COVID-19.
",Mogi das Cruzes - SP,CLAUDIO MIRANDA SANT ANA ,2021,https://portal.conasems.org.br/brasil-aqui-tem-sus/experiencias/1775_titulo-o-trabalho-da-psicologia-na-equipe-multiprofissional-no-hospital-de-campanha-de-mogi-das-cruzes-sp-a-integralidade-do-cuidado-ao-paciente-covid-19
Apoio Psicossocial aos Profissionais da Saúde no enfrentamento à COVID-19 no município de Presidente Prudente.,Presidente Prudente - SP,MANUELA DE MATTOS FIORONI,2021,https://portal.conasems.org.br/brasil-aqui-tem-sus/experiencias/1750_apoio-psicossocial-aos-profissionais-da-saude-no-enfrentamento-a-covid-19-no-municipio-de-presidente-prudente
GRUPO “VIVA MELHOR” EM CASA:  NOVO ESPAÇO PARA A PRÁTICA DE ATIVIDADE FÍSICA,Presidente Prudente - SP,JUZIANE TEIXEIRA GUIçA,2021,https://portal.conasems.org.br/brasil-aqui-tem-sus/experiencias/1751_grupo-viva-melhor-em-casa-novo-espaco-para-a-pratica-de-atividade-fisica
ESTRATÉGIAS DE PLANEJAMENTO PARA A RETOMADA DOS ATENDIMENTOS ODONTOLÓGICOS ELETIVOS EM TEMPOS DE COVID-19 E CONTRUÇÃO DE PROTOCOLO LOCAL,Presidente Prudente - SP,JULIANE HUNGARO DE CARVALHO,2021,https://portal.conasems.org.br/brasil-aqui-tem-sus/experiencias/1752_estrategias-de-planejamento-para-a-retomada-dos-atendimentos-odontologicos-eletivos-em-tempos-de-covid-19-e-contrucao-de-protocolo-local
Implantação de ações em telessaúde nas unidades que compõem a rede de atenção à saúde do município de Ribeirão Preto – SP frente à Pandemia pelo novo coronavírus.,Ribeirão Preto - SP,THATIANE DELATORRE,2021,https://portal.conasems.org.br/brasil-aqui-tem-sus/experiencias/1777_implantacao-de-acoes-em-telessaude-nas-unidades-que-compoem-a-rede-de-atencao-a-saude-do-municipio-de-ribeirao-preto-sp-frente-a-pandemia-pelo-novo-coronavirus
Organização e adequação do processo de trabalho para o atendimento aos pacientes com suspeita de Covid-19 nas Unidades de Saúde do Município de Ribeirão Preto – SP.,Ribeirão Preto - SP,MIRELA MODOLO MARTINS,2021,https://portal.conasems.org.br/brasil-aqui-tem-sus/experiencias/1776_organizacao-e-adequacao-do-processo-de-trabalho-para-o-atendimento-aos-pacientes-com-suspeita-de-covid-19-nas-unidades-de-saude-do-municipio-de-ribeirao-preto-sp
"Comissão de Controle de Infecção e Núcleo de Segurança do Paciente: apoio às unidades de saúde de Ribeirão Preto – SP, frente à pandemia pelo Coronavírus.",Ribeirão Preto - SP,MARIA DE FATIMA PAIVA BRITO,2021,https://portal.conasems.org.br/brasil-aqui-tem-sus/experiencias/1778_comissao-de-controle-de-infeccao-e-nucleo-de-seguranca-do-paciente-apoio-as-unidades-de-saude-de-ribeirao-preto-sp-frente-a-pandemia-pelo-coronavirus
Implantação e organização do serviço telefônico de informações e de telemedicina de Ribeirão Preto - Disque COVID-19.,Ribeirão Preto - SP,ANA PAULA RAIZARO,2021,https://portal.conasems.org.br/brasil-aqui-tem-sus/experiencias/1780_implantacao-e-organizacao-do-servico-telefonico-de-informacoes-e-de-telemedicina-de-ribeirao-preto-disque-covid-19
Atualização dos profissionais para paramentação e desparamentação durante a pandemia de COVID-19 por meio da plataforma Moodle  ,Ribeirão Preto - SP,LAUREN SUEMI KAWATA,2021,https://portal.conasems.org.br/brasil-aqui-tem-sus/experiencias/1779_atualizacao-dos-profissionais-para-paramentacao-e-desparamentacao-durante-a-pandemia-de-covid-19-por-meio-da-plataforma-moodle
Perfil demográfico e função renal de pacientes atendidos em primeira consulta com médico nefrologista ,Santana de Parnaíba - SP,FARID SAMAAN,2021,https://portal.conasems.org.br/brasil-aqui-tem-sus/experiencias/1753_perfil-demografico-e-funcao-renal-de-pacientes-atendidos-em-primeira-consulta-com-medico-nefrologista
"A TECNOLOGIA A FAVOR DO CUIDADO, CENTRAL 0800 24 H PARA DUVIDAS SOBRE COVID 19 E APP ATIVO FAZEM PARTE DAS ESTRATEGIAS CRIADAS PELA SECRETARIA DE SAUDE DE SANTO ANDRE PARA QUALIFICAR O CUIDADO ",Santo André - SP,ANA LUCIA LEITE CHAVES,2021,https://portal.conasems.org.br/brasil-aqui-tem-sus/experiencias/1732_a-tecnologia-a-favor-do-cuidado-central-0800-24-h-para-duvidas-sobre-covid-19-e-app-ativo-fazem-parte-das-estrategias-criadas-pela-secretaria-de-saude-de-santo-andre-para-qualificar-o-cuidado
A CONSTRUÇÃO DE TRÊS HOSPITAIS DE CAMPANHA COM MAIS DE 400 LEITOS EM MENOS DE 30 DIAS - A PANDEMIA CHEGOU E A CORRIDA CONTRA O RELÓGIO TAMBÉM,Santo André - SP,JIMMY TEIXEIRA ACHA,2021,https://portal.conasems.org.br/brasil-aqui-tem-sus/experiencias/1731_a-construcao-de-tres-hospitais-de-campanha-com-mais-de-400-leitos-em-menos-de-30-dias-a-pandemia-chegou-e-a-corrida-contra-o-relogio-tambem
SERVIÇO DE TELEMONITORAMENTO DE PACIENTES COM SÍNDROME GRIPAL/COVID-19 DA SECRETARIA MUNICIPAL DA SAÚDE DE SANTO ANDRÉ,Santo André - SP,STEFANIE KULPA,2021,https://portal.conasems.org.br/brasil-aqui-tem-sus/experiencias/1733_servico-de-telemonitoramento-de-pacientes-com-sindrome-gripal-covid-19-da-secretaria-municipal-da-saude-de-santo-andre
CENTRAL DE VISITA VIRTUAL APROXIMA FAMILIAS DOS PACIENTES INTERNADOS NOS HOSPITAIS DE CAMPANHA DE SANTO ANDRE,Santo André - SP,VICTOR CHIAVEGATO,2021,https://portal.conasems.org.br/brasil-aqui-tem-sus/experiencias/1730_central-de-visita-virtual-aproxima-familias-dos-pacientes-internados-nos-hospitais-de-campanha-de-santo-andre
"Organização da Linha de Cuidado do Indivíduo com COVID-19 no
Município de Santo André.",Santo André - SP,MARIA CAROLINA PESTANA DE ANDRADE DO NASCIMENTO,2021,https://portal.conasems.org.br/brasil-aqui-tem-sus/experiencias/1734_organizacao-da-linha-de-cuidado-do-individuo-com-covid-19-no-municipio-de-santo-andre
 Pit Stop da Prevenção - As ações da gestão municipal e serviços de saúde no enfrentamento à covid-19 ,Santo André - SP,ANTONIO CARLOS DO NASCIMENTO,2021,https://portal.conasems.org.br/brasil-aqui-tem-sus/experiencias/1754_pit-stop-da-prevencao-as-acoes-da-gestao-municipal-e-servicos-de-saude-no-enfrentamento-a-covid-19
PROJETO BEM-ESTAR: EXPERIÊNCIA DE PRÁTICAS INTEGRATIVAS E COMPLEMENTARES COM TRABALHADORES DA SAÚDE DURANTE A PANDEMIA DE COVID19 NO MUNICÍPIO DE SANTO ANDRÉ-SP,Santo André - SP,LUCIANA RAMIRES COLETI,2021,https://portal.conasems.org.br/brasil-aqui-tem-sus/experiencias/1781_projeto-bem-estar-experiencia-de-praticas-integrativas-e-complementares-com-trabalhadores-da-saude-durante-a-pandemia-de-covid19-no-municipio-de-santo-andre-sp
 Estratégias de Comunicação e Humanização como ferramentas de assistência ao paciente e a família em um Hospital de Campanha,Sorocaba - SP,CAIO AUGUSTO SABOYA RIBEIRO,2021,https://portal.conasems.org.br/brasil-aqui-tem-sus/experiencias/1787_estrategias-de-comunicacao-e-humanizacao-como-ferramentas-de-assistencia-ao-paciente-e-a-familia-em-um-hospital-de-campanha
IMPLANTAÇÃO E GESTÃO DE PROCESSO DE TRABALHO EM HOSPITAL DE CAMPANHA ,Sorocaba - SP,JéSSICA MACIEL FROTA PINTO,2021,https://portal.conasems.org.br/brasil-aqui-tem-sus/experiencias/1788_implantacao-e-gestao-de-processo-de-trabalho-em-hospital-de-campanha
REDUÇÃO DA LETALIDADE DA COVID-19 APÓS ESTRATÉGIAS DE TRIAGEM E INTERNAÇÃO PRECOCES DE PACIENTES COM SÍNDROME GRIPAL,Sorocaba - SP,PRISCILA HELENA DOS SANTOS,2021,https://portal.conasems.org.br/brasil-aqui-tem-sus/experiencias/1786_reducao-da-letalidade-da-covid-19-apos-estrategias-de-triagem-e-internacao-precoces-de-pacientes-com-sindrome-gripal
" Plano de ContingênCia do Departamento de Atenção Hospitalar de Urgência e
 Emergência ( DAHUE ) para Enfrentamento do COVID 19. 
",São Bernardo do Campo - SP,ANA ELISA SILVA DE PAULA,2021,https://portal.conasems.org.br/brasil-aqui-tem-sus/experiencias/1735_plano-de-contingencia-do-departamento-de-atencao-hospitalar-de-urgencia-e-emergencia-dahue-para-enfrentamento-do-covid-19
Implantação de Instrumento de Fases de Transição para Organização da Assistência na Atenção Primária à Saúde no Município de São Bernardo do Campo,São Bernardo do Campo - SP,CAROLINE AMORIM MESQUITA DE OLIVEIRA,2021,https://portal.conasems.org.br/brasil-aqui-tem-sus/experiencias/1737_implantacao-de-instrumento-de-fases-de-transicao-para-organizacao-da-assistencia-na-atencao-primaria-a-saude-no-municipio-de-sao-bernardo-do-campo
ADAPTAÇÃO DO HOSPITAL DE URGÊNCIA DE SÃO BERNARDO DO CAMPO  EM HOSPITAL REFERÊNCIA PARA O ATENDIMENTO DE PACIENTES COM COVID 19,São Bernardo do Campo - SP,CARLOS ANTONIO FADEL ,2021,https://portal.conasems.org.br/brasil-aqui-tem-sus/experiencias/1739_adaptacao-do-hospital-de-urgencia-de-sao-bernardo-do-campo-em-hospital-referencia-para-o-atendimento-de-pacientes-com-covid-19
Experiência de Cuidado em Saúde Mental de profissionais de uma Unidade Básica de Saúde durante a pandemia do Covid-19.,São Bernardo do Campo - SP,DANIEL SCURATO,2021,https://portal.conasems.org.br/brasil-aqui-tem-sus/experiencias/1736_experiencia-de-cuidado-em-saude-mental-de-profissionais-de-uma-unidade-basica-de-saude-durante-a-pandemia-do-covid-19
